{
  "id": "2017-01-20-ind-lal-robinson-2v3",
  "title": "Pacers @ Lakers — Glenn Robinson III jumper inside the arc credited as a 3; corrected 108-96 to 108-95 a week later (Jan 20-27, 2017)",
  "status": "verified-partial",
  "verification_level": "official-nba-confirmed",
  "game_date": "2017-01-20",
  "season": "2016-17",
  "away_team": "Indiana Pacers",
  "home_team": "Los Angeles Lakers",
  "venue": "Staples Center, Los Angeles",
  "incident_summary": "With 1:49 remaining in the fourth quarter, Pacers guard/forward Glenn Robinson III made a jump shot from inside the three-point line, but the basket was incorrectly credited as a 3-point field goal. The game ended with an announced final of Lakers 108, Pacers 96. Seven days later, on Jan 27, 2017, the NBA announced the scoring error: the statistics were corrected, Robinson's scoring total was changed to five points, and the official final score became Lakers 108, Pacers 95 — a one-point correction that changed the combined total from 204 to 203. The league stated the error impacted the final score but not the final outcome.",
  "classification": {
    "type": "two-vs-three-point-ruling",
    "layer": "official-record-wrong-then-corrected",
    "outcome": "corrected-next-day"
  },
  "period_clock": "Q4, 1:49 remaining",
  "scoring_play": "Glenn Robinson III (IND) made jump shot from inside the three-point line — credited 3, should have been 2.",
  "score_before": null,
  "affected_player": "Glenn Robinson III (IND) — scoring total corrected to 5 points",
  "affected_team": "Indiana Pacers",
  "originally_reported": {
    "value": "Lakers 108, Pacers 96",
    "total": 204,
    "basis": "DERIVED (labeled): corrected final 108-95 (NBA release) plus the single reversed point. No reviewed source quotes the original 108-96 line directly — corroborate against an archived pre-correction box score (see open questions)."
  },
  "corrected_value": {
    "value": "Lakers 108, Pacers 95 (−1 IND: Robinson III 3-pointer reclassified as a 2)",
    "total": 203,
    "basis": "NBA announcement Jan 27, 2017 (NBA.com Lakers release; AP)."
  },
  "final_official": {
    "value": "Lakers 108, Pacers 95",
    "total": 203,
    "basis": "Corrected official final per the NBA release and AP, Jan 27, 2017."
  },
  "sources_disagreed": [
    "Game-night official entry (Robinson III 3-pointer) vs. corrected league record (2-pointer)",
    "Secondary outlets briefly carried the 108-96 final before updating to 108-95"
  ],
  "cause": {
    "determination": "suspected",
    "detail": "Suspected real-time 2-vs-3 misclassification by the game-night crew (shot location misjudged). The league announcement describes the error but does not state a cause — do not assert one beyond the misclassification itself. Notably, the in-game 2-vs-3 replay review did not catch it that night."
  },
  "official_record_was_wrong": "yes-temporarily",
  "timeline": [
    {
      "date": "2017-01-20",
      "event": "Pacers @ Lakers at Staples Center; Robinson III's inside-the-arc jumper at Q4 1:49 is credited as a 3. Game ends announced Lakers 108, Pacers 96.",
      "source_index": 0
    },
    {
      "date": "2017-01-27",
      "event": "NBA announces the scoring error, corrects the statistics (Robinson to 5 points), and sets the final at Lakers 108, Pacers 95. League: error impacted the score but not the outcome. Video of the shot linked in the release.",
      "source_index": 0
    }
  ],
  "sources": [
    {
      "url": "https://www.nba.com/lakers/releases/nba-corrects-scoring-error-from-pacers-lakers-game",
      "publisher": "NBA.com (Lakers team release, league announcement)",
      "tier": "official-nba",
      "confirms": "Full incident: Jan 20 game at Staples Center; Robinson III 3 credited on inside-the-line jumper at Q4 1:49; stats corrected; final 108-95; Robinson to 5 points; score impacted, outcome not; video link. (Lead first surfaced by the PR #2 session; independently re-verified here.)",
      "accessed": "2026-10-07"
    },
    {
      "url": "https://www.foxsports.com/stories/nba/nba-corrects-lakers-pacers-scoring-error",
      "publisher": "FOX Sports (Associated Press)",
      "tier": "wire-ap",
      "confirms": "AP: NBA corrected the error Jan 27; Robinson III wrongly credited 3 on inside-the-line jumper with 1:49 left; Jan 20 game now 108-95.",
      "accessed": "2026-10-07"
    },
    {
      "url": "https://abc7.com/sports/nba-corrects-scoring-error-in-lakers-pacers-game/1724736/",
      "publisher": "ABC7 Los Angeles",
      "tier": "team-beat",
      "confirms": "Same correction (Jan 27, 2017; Lakers home win over Pacers).",
      "accessed": "2026-10-07"
    }
  ],
  "disputed_points": [],
  "open_questions": [
    "Direct quotation of the original 108-96 final (currently derived: 108-95 + 1). Priority: archived pre-correction box score.",
    "Score of the game at Q4 1:49 (running score before the play) — undocumented in reviewed sources.",
    "Why the in-game 2-vs-3 review did not catch the misclassification that night — undocumented; do not speculate.",
    "Outcome enum notes: corrected 7 days later, not next day — schema v2 should add 'corrected-later' (see ROADMAP)."
  ],
  "betting_notes": null,
  "reproduce_steps": [
    "Read the NBA.com Lakers release for the play, the correction, and the 108-95 final.",
    "Cross-check the AP report (FOX Sports) for the same facts.",
    "Watch the linked league video of Robinson's shot to confirm the inside-the-arc location.",
    "Compare an archived Jan 20-26 box score (108-96) against the current corrected box score (108-95)."
  ],
  "last_reviewed": "2026-10-07"
}
