{
  "id": "2022-01-24-uta-phx-paul-assist",
  "title": "Jazz @ Suns — Assist wrongly credited to Chris Paul, re-assigned to Mikal Bridges next day (Jan 24-25, 2022)",
  "status": "verified-partial",
  "verification_level": "multi-secondary-confirmed",
  "game_date": "2022-01-24",
  "season": "2021-22",
  "away_team": "Utah Jazz",
  "home_team": "Phoenix Suns",
  "venue": null,
  "incident_summary": "In the Jazz-Suns game of Jan 24, 2022, an assist was erroneously credited to Suns guard Chris Paul. After bettors flagged the error on social media, the NBA corrected the box score the next day (Jan 25): the assist was taken away from Paul and credited to Suns teammate Mikal Bridges. The game score/total was never in dispute — this is a non-scoring stat correction, included because it documents the league's post-game correction pipeline and same-week pattern (paired with the Jan 27-28 Edwards steal correction).",
  "classification": {
    "type": "stat-correction-non-scoring",
    "layer": "official-record-wrong-then-corrected",
    "outcome": "corrected-next-day"
  },
  "period_clock": null,
  "scoring_play": "Unspecified assist play — quarter, clock, and teams' score at the time were not documented in the reviewed sources. Do not infer.",
  "score_before": null,
  "affected_player": "Chris Paul (PHX) — assist removed; Mikal Bridges (PHX) — assist added",
  "affected_team": "Phoenix Suns",
  "originally_reported": {
    "value": "Assist credited to Chris Paul",
    "total": null,
    "basis": "Game-night official box score, Jan 24, 2022 (ESPN)."
  },
  "corrected_value": {
    "value": "Assist taken from Paul, credited to Mikal Bridges",
    "total": null,
    "basis": "NBA post-game correction, Jan 25, 2022 (ESPN)."
  },
  "final_official": {
    "value": "Assist: Mikal Bridges (corrected box score)",
    "total": null,
    "basis": "Corrected official box score (ESPN). Game final score was never disputed and is out of scope for this record — not asserted here."
  },
  "sources_disagreed": [
    "Game-night box score (Paul assist) vs. corrected box score (Bridges assist)"
  ],
  "cause": {
    "determination": "suspected",
    "detail": "Suspected real-time attribution error by the in-game stat crew (wrong player credited for one assist). The league/NBA Operations updates only assists credited to the wrong player postgame (per the NBA email quoted by ESPN) — consistent with this fix. Exact crew-level cause undocumented."
  },
  "official_record_was_wrong": "yes-temporarily",
  "timeline": [
    {
      "date": "2022-01-24",
      "event": "Jazz @ Suns; assist erroneously credited to Chris Paul in the game-night box score.",
      "source_index": 0
    },
    {
      "date": "2022-01-25",
      "event": "After bettors voice frustration on social media, the NBA takes the assist from Paul and credits Mikal Bridges.",
      "source_index": 0
    }
  ],
  "sources": [
    {
      "url": "https://www.espn.com/sports-betting/story/_/id/33169135/nba-issues-second-stat-correction-week",
      "publisher": "ESPN",
      "tier": "major-sports-media",
      "confirms": "Paul erroneously credited with an assist Jan 24; corrected to Bridges on Tuesday after bettor outcry; sportsbook settlement policies (BetMGM/DK settle on day-of box; FanDuel honored the Edwards correction).",
      "accessed": "2026-10-07"
    },
    {
      "url": "https://www.espn.com/espn/print?id=33355887",
      "publisher": "ESPN",
      "tier": "major-sports-media",
      "confirms": "Recap of the Paul-to-Bridges correction; Elias/NBA 'rare' characterization; NBA email policy (assists at arena statisticians' discretion; Operations only fixes wrong-player assists postgame).",
      "accessed": "2026-10-07"
    }
  ],
  "disputed_points": [],
  "open_questions": [
    "Exact assist play (quarter/clock/scorer) — undocumented in reviewed sources.",
    "Game final score — intentionally not asserted (never disputed); add from the official box score if needed for context.",
    "Primary NBA correction notice URL, if one was published."
  ],
  "betting_notes": "Per ESPN: BetMGM and DraftKings (official NBA betting partners) typically settle on the day-of box score, so next-day corrections do not move graded bets; bettor outcry preceded this correction.",
  "reproduce_steps": [
    "Read the ESPN Jan 28 article for the Paul-to-Bridges correction and its betting context.",
    "Read the ESPN Feb 24 recap for the league/Elias rarity statements and the assists policy email.",
    "Compare an archived Jan 24 box score against the current corrected box score for this game."
  ],
  "last_reviewed": "2026-10-07"
}
